<?xml version="1.0" encoding="UTF-8" ?>
<!ELEMENT plan (course+)>
<!ELEMENT course (name,hour,exam-form)>
<!ATTLIST course id CDATA "">
<!ELEMENT name (#PCDATA)>
<!ELEMENT hour (#PCDATA)>
<!ELEMENT exam-form (#PCDATA)>